"","Item","StationaryDistribution"
"Couriers.and.messengers.","Couriers and messengers (x 1,000,000)",0.000352694088863681
"Iron.and.steel.mills.and.ferro.alloy.manufacturing.","Iron and steel mills and ferro-alloy manufacturing (x 1,000,000)",0.000340863573108758
"Potash.mining.","Potash mining (x 1,000,000)",0.000338558755932063
"Electrical.equipment..appliance.and.component.manufacturing.","Electrical equipment, appliance and component manufacturing (x 1,000,000)",0.000326595785044698
"Pesticide..fertilizer.and.other.agricultural.chemical.manufacturing.","Pesticide, fertilizer and other agricultural chemical manufacturing (x 1,000,000)",0.000323100375820903
"Non.residential.building.construction.","Non-residential building construction (x 1,000,000)",0.000320686848199385
"Office.furniture..including.fixtures..manufacturing.","Office furniture (including fixtures) manufacturing (x 1,000,000)",0.000316751411506906
"Forging.and.stamping.","Forging and stamping (x 1,000,000)",0.00031606794229095
"Motor.vehicle.manufacturing.","Motor vehicle manufacturing (x 1,000,000)",0.00031073290986442
"Utilities.","Utilities (x 1,000,000)",0.000309539026860718
"Fruit.and.vegetable.preserving.and.specialty.food.manufacturing.","Fruit and vegetable preserving and specialty food manufacturing (x 1,000,000)",0.000295817270236597
"General.merchandise.stores.","General merchandise stores (x 1,000,000)",0.000286684836484398
"Lessors.of.non.financial.intangible.assets..except.copyrighted.works..","Lessors of non-financial intangible assets (except copyrighted works) (x 1,000,000)",0.000284171703731122
"Electrical.equipment.manufacturing.","Electrical equipment manufacturing (x 1,000,000)",0.000268657535021522
"Non.metallic.mineral.product.manufacturing.","Non-metallic mineral product manufacturing (x 1,000,000)",0.000265872881903839
"Commercial.and.service.industry.machinery.manufacturing.","Commercial and service industry machinery manufacturing (x 1,000,000)",0.000264424875908243
"Private.households.","Private households (x 1,000,000)",0.000262584432111796
"Accommodation.services.","Accommodation services (x 1,000,000)",0.000251363751408269
"Miscellaneous.transportation.equipment.manufacturing.","Miscellaneous transportation equipment manufacturing (x 1,000,000)",0.000251042801828492
"Offices.of.real.estate.agents.and.brokers.and.activities.related.to.real.estate.","Offices of real estate agents and brokers and activities related to real estate (x 1,000,000)",0.000245196026593889
"Gambling.industries.","Gambling industries (x 1,000,000)",0.000232154233013462
"Medical.equipment.and.supplies.manufacturing.","Medical equipment and supplies manufacturing (x 1,000,000)",0.000231873310885975
"Converted.paper.product.manufacturing.","Converted paper product manufacturing (x 1,000,000)",0.000223306620077468
"Food.and.beverage.stores.","Food and beverage stores (x 1,000,000)",0.000221487086971194
"Semiconductor.and.other.electronic.component.manufacturing.","Semiconductor and other electronic component manufacturing (x 1,000,000)",0.000214864842775822
"Other.miscellaneous.manufacturing.","Other miscellaneous manufacturing (x 1,000,000)",0.000214783528867523
"Petroleum.and.coal.product.manufacturing.","Petroleum and coal product manufacturing (x 1,000,000)",0.000214750663804008
"Paint..coating.and.adhesive.manufacturing.","Paint, coating and adhesive manufacturing (x 1,000,000)",0.000201795349208478
"Non.metallic.mineral.product.manufacturing..except.cement.and.concrete.products..","Non-metallic mineral product manufacturing (except cement and concrete products) (x 1,000,000)",0.000201229155639126
"Sugar.and.confectionery.product.manufacturing.","Sugar and confectionery product manufacturing (x 1,000,000)",0.000196814659018984
"Coal.mining.","Coal mining (x 1,000,000)",0.000195659438347788
"Cement.and.concrete.product.manufacturing.","Cement and concrete product manufacturing (x 1,000,000)",0.000190461158395352
"Non.ferrous.metal..except.aluminum..production.and.processing.","Non-ferrous metal (except aluminum) production and processing (x 1,000,000)",0.000184132132870385
"Wineries.and.distilleries.","Wineries and distilleries (x 1,000,000)",0.00018335193215322
"Coating..engraving..heat.treating.and.allied.activities.","Coating, engraving, heat treating and allied activities (x 1,000,000)",0.000168876344168304
"Other.metal.ore.mining.","Other metal ore mining (x 1,000,000)",0.000163737080645441
"Other.transportation.equipment.manufacturing.","Other transportation equipment manufacturing (x 1,000,000)",0.000162733015392971
"Fishing..hunting.and.trapping.","Fishing, hunting and trapping (x 1,000,000)",0.000158056399920866
"Petroleum.refineries.","Petroleum refineries (x 1,000,000)",0.000157701938040908
"Engine..turbine.and.power.transmission.equipment.manufacturing.","Engine, turbine and power transmission equipment manufacturing (x 1,000,000)",0.000157206264937072
"Other.electronic.product.manufacturing.","Other electronic product manufacturing (x 1,000,000)",0.000153735232944535
"Tobacco.manufacturing.","Tobacco manufacturing (x 1,000,000)",0.000151960961850395
"Miscellaneous.manufacturing.","Miscellaneous manufacturing (x 1,000,000)",0.000139487150212357
"Breweries.","Breweries (x 1,000,000)",0.000130951974354237
"Farm.product.wholesaler.distributors.","Farm product wholesaler-distributors (x 1,000,000)",0.000127475110097187
"Other.chemical.product.manufacturing.","Other chemical product manufacturing (x 1,000,000)",0.000123047480232567
"Beverage.and.tobacco.product.manufacturing.","Beverage and tobacco product manufacturing (x 1,000,000)",0.000122960900025246
"Seafood.product.preparation.and.packaging.","Seafood product preparation and packaging (x 1,000,000)",0.000107730460878502
"Soft.drink.and.ice.manufacturing.","Soft drink and ice manufacturing (x 1,000,000)",8.8771032961086e-05
