"","Item","StationaryDistribution"
"Lessors.of.real.estate.","Lessors of real estate (x 1,000,000)",0.0213179468822876
"Owner.occupied.dwellings.","Owner-occupied dwellings (x 1,000,000)",0.0212650413805944
"Real.estate.and.rental.and.leasing.","Real estate and rental and leasing (x 1,000,000)",0.0202156225379483
"Service.producing.industries.","Service-producing industries (x 1,000,000)",0.020011574401024
"Real.estate.","Real estate (x 1,000,000)",0.0199889356836826
"Business.sector..services.","Business sector, services (x 1,000,000)",0.0192403434382824
"All.industries.","All industries (x 1,000,000)",0.0171739995711101
"Computer.systems.design.and.related.services.","Computer systems design and related services (x 1,000,000)",0.0166349702928291
"Other.information.services.","Other information services (x 1,000,000)",0.0161992417700185
"Business.sector.industries.","Business sector industries (x 1,000,000)",0.0158620027576008
"Universities.","Universities (x 1,000,000)",0.0156938206604608
"Professional..scientific.and.technical.services.","Professional, scientific and technical services (x 1,000,000)",0.0153911962862242
"Waste.management.and.remediation.services.","Waste management and remediation services (x 1,000,000)",0.0151489480276826
"Food.services.and.drinking.places.","Food services and drinking places (x 1,000,000)",0.0143832434335045
"Accounting..tax.preparation..bookkeeping.and.payroll.services.","Accounting, tax preparation, bookkeeping and payroll services (x 1,000,000)",0.0143777367590985
"Non.business.sector..services.","Non-business sector, services (x 1,000,000)",0.013558744895084
"Non.business.sector.industries.","Non-business sector industries (x 1,000,000)",0.0132825785642703
"Other.services..except.public.administration..","Other services (except public administration) (x 1,000,000)",0.013214268386025
"Repair.and.maintenance.","Repair and maintenance (x 1,000,000)",0.0131114706357911
"Accommodation.and.food.services.","Accommodation and food services (x 1,000,000)",0.01286202404999
"Health.care.and.social.assistance.","Health care and social assistance (x 1,000,000)",0.0127565656614592
"Public.Sector.","Public Sector (x 1,000,000)",0.0126839254229214
"Credit.intermediation.and.monetary.authorities.","Credit intermediation and monetary authorities (x 1,000,000)",0.0125912287966808
"Local.credit.unions.","Local credit unions (x 1,000,000)",0.0124238993446991
"Depository.credit.intermediation.and.monetary.authorities.","Depository credit intermediation and monetary authorities (x 1,000,000)",0.0122160210466566
"Finance.and.insurance.","Finance and insurance (x 1,000,000)",0.0121163921596184
"Veneer..plywood.and.engineered.wood.product.manufacturing.","Veneer, plywood and engineered wood product manufacturing (x 1,000,000)",0.0118476553073947
"Repair.construction.","Repair construction (x 1,000,000)",0.0118405211303863
"Banking..monetary.authorities.and.other.depository.credit.intermediation.","Banking, monetary authorities and other depository credit intermediation (x 1,000,000)",0.0117061240294292
"Ambulatory.health.care.services.","Ambulatory health care services (x 1,000,000)",0.0116399618186835
"Personal.and.household.goods.wholesaler.distributors.","Personal and household goods wholesaler-distributors (x 1,000,000)",0.0112978831833717
"Health.care.","Health care (x 1,000,000)",0.0112466458357654
"Household.appliance.manufacturing.","Household appliance manufacturing (x 1,000,000)",0.0106953388731079
"Information.and.communication.technology..services.","Information and communication technology, services (x 1,000,000)",0.0102359684399676
"Motion.picture.and.sound.recording.industries.","Motion picture and sound recording industries (x 1,000,000)",0.0101751068388301
"Truck.transportation.","Truck transportation (x 1,000,000)",0.0100263129611815
"Health.and.personal.care.stores.","Health and personal care stores (x 1,000,000)",0.00968436708832621
"Transportation.and.warehousing.","Transportation and warehousing (x 1,000,000)",0.00968089008243683
"Air.transportation.","Air transportation (x 1,000,000)",0.00967770415795297
"Advertising..public.relations..and.related.services.","Advertising, public relations, and related services (x 1,000,000)",0.00936126665232813
"Support.activities.for.transportation.","Support activities for transportation (x 1,000,000)",0.00924452015430312
"Management..scientific.and.technical.consulting.services.","Management, scientific and technical consulting services (x 1,000,000)",0.00879778634051442
"Educational.services.","Educational services (x 1,000,000)",0.00879072273818674
"Gold.and.silver.ore.mining.","Gold and silver ore mining (x 1,000,000)",0.00866796013147554
"Information.and.communication.technology.sector.","Information and communication technology sector (x 1,000,000)",0.00864037122988953
"Wholesale.trade.","Wholesale trade (x 1,000,000)",0.00862218525047939
"Hospitals.","Hospitals (x 1,000,000)",0.00845597752470918
"Financial.investment.services..funds.and.other.financial.vehicles.","Financial investment services, funds and other financial vehicles (x 1,000,000)",0.00832581582942705
"Local..municipal.and.regional.public.administration.","Local, municipal and regional public administration (x 1,000,000)",0.00826263929250271
"Residential.building.construction.","Residential building construction (x 1,000,000)",0.00816616778203351
"Other.professional..scientific.and.technical.services.including.scientific.research.and.development.","Other professional, scientific and technical services including scientific research and development (x 1,000,000)",0.00801938235716404
"Retail.trade.","Retail trade (x 1,000,000)",0.00742348817551876
"Employment.services.","Employment services (x 1,000,000)",0.00719965142788366
"Social.Assistance.","Social Assistance (x 1,000,000)",0.0071542412036347
"Administrative.and.support..waste.management.and.remediation.services.","Administrative and support, waste management and remediation services (x 1,000,000)",0.00681505847439064
"Other.educational.services.","Other educational services (x 1,000,000)",0.00680562360157108
"Nursing.and.residential.care.facilities.","Nursing and residential care facilities (x 1,000,000)",0.00671980751297746
"Investigation.and.security.services.","Investigation and security services (x 1,000,000)",0.006522735277663
"Rental.and.leasing.services.","Rental and leasing services (x 1,000,000)",0.00602000888975959
"Non.store.retailers.","Non-store retailers (x 1,000,000)",0.00578927893255052
"Rental.and.leasing.services..except.automotive.equipment..","Rental and leasing services (except automotive equipment) (x 1,000,000)",0.00565947753803618
"Motor.vehicle.and.parts.dealers.","Motor vehicle and parts dealers (x 1,000,000)",0.00558014477837979
"Gasoline.stations.","Gasoline stations (x 1,000,000)",0.00547668703653558
"Rental.and.leasing.services.and.lessors.of.non.financial.intangible.assets..except.copyrighted.works..","Rental and leasing services and lessors of non-financial intangible assets (except copyrighted works) (x 1,000,000)",0.00541686935162698
"Miscellaneous.wholesaler.distributors.","Miscellaneous wholesaler-distributors (x 1,000,000)",0.0053119233989078
"Provincial.and.territorial.public.administration.","Provincial and territorial public administration (x 1,000,000)",0.00522105839795326
"Administrative.and.support.services.","Administrative and support services (x 1,000,000)",0.00515207549366892
"Oil.and.gas.extraction.","Oil and gas extraction (x 1,000,000)",0.00495839168771444
"Non.conventional.oil.extraction.","Non-conventional oil extraction (x 1,000,000)",0.00492562157945238
"Business.sector..goods.","Business sector, goods (x 1,000,000)",0.00492391690597501
"Goods.producing.industries.","Goods-producing industries (x 1,000,000)",0.00486661819496036
"Insurance.carriers.","Insurance carriers (x 1,000,000)",0.0048199786202052
"Construction.","Construction (x 1,000,000)",0.00450321935914695
"Clothing.and.clothing.accessories.stores.","Clothing and clothing accessories stores (x 1,000,000)",0.00440410950907095
"Facilities.and.other.support.services.","Facilities and other support services (x 1,000,000)",0.00423852282882402
"Activities.related.to.credit.intermediation.","Activities related to credit intermediation (x 1,000,000)",0.00422527432220253
"Information.and.cultural.industries.","Information and cultural industries (x 1,000,000)",0.00417904694555907
"Sawmills.and.wood.preservation.","Sawmills and wood preservation (x 1,000,000)",0.00415951586418676
"Metal.ore.mining.","Metal ore mining (x 1,000,000)",0.00414382788941674
"Rail.transportation.","Rail transportation (x 1,000,000)",0.00399623285054518
"Other.food.manufacturing.","Other food manufacturing (x 1,000,000)",0.0039295986872055
"Printing.and.related.support.activities.","Printing and related support activities (x 1,000,000)",0.00392003182765203
"Water..sewage.and.other.systems.","Water, sewage and other systems (x 1,000,000)",0.00383698404400348
"Insurance.carriers.and.related.activities.","Insurance carriers and related activities (x 1,000,000)",0.00375595480945835
"Crude.oil.and.other.pipeline.transportation.","Crude oil and other pipeline transportation (x 1,000,000)",0.00372085837916009
"Motor.vehicle.and.parts.wholesaler.distributors.","Motor vehicle and parts wholesaler-distributors (x 1,000,000)",0.00330801933759542
"Non.business.sector..goods.","Non-business sector, goods (x 1,000,000)",0.00317103475460198
"Sand..gravel..clay..and.ceramic.and.refractory.minerals.mining.and.quarrying.","Sand, gravel, clay, and ceramic and refractory minerals mining and quarrying (x 1,000,000)",0.00314993567637133
"Non.depository.credit.intermediation.","Non-depository credit intermediation (x 1,000,000)",0.00309553646382302
"Wood.product.manufacturing.","Wood product manufacturing (x 1,000,000)",0.0029216541259936
"Amusement.and.recreation.industries.","Amusement and recreation industries (x 1,000,000)",0.00286573288724585
"Public.administration.","Public administration (x 1,000,000)",0.00284966691408809
"Other.professional..scientific.and.technical.services.","Other professional, scientific and technical services (x 1,000,000)",0.002818222037336
"Mining.and.quarrying..except.oil.and.gas..","Mining and quarrying (except oil and gas) (x 1,000,000)",0.00280401441769102
"Industrial.production.","Industrial production (x 1,000,000)",0.00274277218028569
"Industrial.production..1950.definition..","Industrial production (1950 definition) (x 1,000,000)",0.0024483403625279
"Pay.and.specialty.television.","Pay and specialty television (x 1,000,000)",0.00244595580205661
"Motor.vehicle.parts.manufacturing.","Motor vehicle parts manufacturing (x 1,000,000)",0.00239836498794745
"Office.administrative.services.","Office administrative services (x 1,000,000)",0.00236337702666249
"Non.depository.credit.intermediation.and.activities.related.to.credit.intermediation.","Non-depository credit intermediation and activities related to credit intermediation (x 1,000,000)",0.00236132083409889
"Aboriginal.public.administration.","Aboriginal public administration (x 1,000,000)",0.00226523334050328
"Animal.food.manufacturing.","Animal food manufacturing (x 1,000,000)",0.0022569712771679
"Engineering.and.other.construction.activities.","Engineering and other construction activities (x 1,000,000)",0.0022564054186587
"Agriculture..forestry..fishing.and.hunting.","Agriculture, forestry, fishing and hunting (x 1,000,000)",0.00225590190404443
"Plastics.and.rubber.products.manufacturing.","Plastics and rubber products manufacturing (x 1,000,000)",0.00213837548083953
"Building.material.and.supplies.wholesaler.distributors.","Building material and supplies wholesaler-distributors (x 1,000,000)",0.00204238892863768
"Legal..accounting.and.related.services.","Legal, accounting and related services (x 1,000,000)",0.00203805705846127
"Plastic.product.manufacturing.","Plastic product manufacturing (x 1,000,000)",0.00200978904682869
"Arts..entertainment.and.recreation.","Arts, entertainment and recreation (x 1,000,000)",0.00195326707867471
"Manufacturing.","Manufacturing (x 1,000,000)",0.00194464639654251
"Crop.production.","Crop production (x 1,000,000)",0.00192959245696186
"Crop.and.animal.production.","Crop and animal production (x 1,000,000)",0.00192592586531765
"Support.activities.for.agriculture.and.forestry.","Support activities for agriculture and forestry (x 1,000,000)",0.00190683228765657
"Business.support.services.","Business support services (x 1,000,000)",0.00185976554671404
"Grain.and.oilseed.milling.","Grain and oilseed milling (x 1,000,000)",0.0018448025553003
"Food.manufacturing.","Food manufacturing (x 1,000,000)",0.00180392831913388
"Energy.sector.","Energy sector (x 1,000,000)",0.00179040229654183
"Architectural..engineering.and.related.services.","Architectural, engineering and related services (x 1,000,000)",0.0017176398596224
"Machinery..equipment.and.supplies.wholesaler.distributors.","Machinery, equipment and supplies wholesaler-distributors (x 1,000,000)",0.00170011986424231
"Amusement..gambling.and.recreation.industries.","Amusement, gambling and recreation industries (x 1,000,000)",0.00167649432544626
"Transit..ground.passenger..scenic.and.sightseeing.transportation.","Transit, ground passenger, scenic and sightseeing transportation (x 1,000,000)",0.0016430774542794
"Federal.government.public.administration..except.defence..","Federal government public administration (except defence) (x 1,000,000)",0.00160094098133478
"Mining..quarrying..and.oil.and.gas.extraction.","Mining, quarrying, and oil and gas extraction (x 1,000,000)",0.00153628818611104
"Religious..grant.making..civic..and.professional.and.similar.organizations.","Religious, grant-making, civic, and professional and similar organizations (x 1,000,000)",0.00150761485886511
"Taxi.and.limousine.service.","Taxi and limousine service (x 1,000,000)",0.00148563534223476
"Durable.manufacturing.industries.","Durable manufacturing industries (x 1,000,000)",0.00147255276196011
"Transportation.equipment.manufacturing.","Transportation equipment manufacturing (x 1,000,000)",0.00145722844808956
"Scientific.research.and.development.services.","Scientific research and development services (x 1,000,000)",0.0014404015450763
"Federal.government.public.administration.","Federal government public administration (x 1,000,000)",0.00141787734476243
"Petroleum.product.wholesaler.distributors.","Petroleum product wholesaler-distributors (x 1,000,000)",0.00135117008798215
"Defence.services.","Defence services (x 1,000,000)",0.00134997851789824
"Non.durable.manufacturing.industries.","Non-durable manufacturing industries (x 1,000,000)",0.00134779382744325
"Specialized.design.services.","Specialized design services (x 1,000,000)",0.0012936705424546
"Industrial.machinery.manufacturing.","Industrial machinery manufacturing (x 1,000,000)",0.00129020867201981
"Personal.and.laundry.services.","Personal and laundry services (x 1,000,000)",0.00127173408572507
"Community.colleges.and.C.E.G.E.P.s.","Community colleges and C.E.G.E.P.s (x 1,000,000)",0.00122514294026694
"Telecommunications.","Telecommunications (x 1,000,000)",0.0012187883676974
"Iron.ore.mining.","Iron ore mining (x 1,000,000)",0.00121703464254038
"Wholesale.electronic.markets..and.agents.and.brokers.","Wholesale electronic markets, and agents and brokers (x 1,000,000)",0.00120016020009247
"Services.to.buildings.and.dwellings.","Services to buildings and dwellings (x 1,000,000)",0.00118264531440652
"Broadcasting..except.Internet..","Broadcasting (except Internet) (x 1,000,000)",0.0011673893429463
"Bakeries.and.tortilla.manufacturing.","Bakeries and tortilla manufacturing (x 1,000,000)",0.0011646915737317
"Performing.arts..spectator.sports.and.related.industries..and.heritage.institutions.","Performing arts, spectator sports and related industries, and heritage institutions (x 1,000,000)",0.00116004431312538
"Water.transportation.","Water transportation (x 1,000,000)",0.00112251527892057
"Fabricated.metal.product.manufacturing.","Fabricated metal product manufacturing (x 1,000,000)",0.00112046817694099
"Postal.service.and.couriers.and.messengers.","Postal service and couriers and messengers (x 1,000,000)",0.00111073890477419
"Electronics.and.appliance.stores.","Electronics and appliance stores (x 1,000,000)",0.00110947631565567
"Automotive.equipment.rental.and.leasing.","Automotive equipment rental and leasing (x 1,000,000)",0.0010709223090204
"Pipeline.transportation.","Pipeline transportation (x 1,000,000)",0.00102662994897049
"Natural.gas.distribution.","Natural gas distribution (x 1,000,000)",0.00101731507420195
"Building.material.and.garden.equipment.and.supplies.dealers.","Building material and garden equipment and supplies dealers (x 1,000,000)",0.00101708114626259
"Electronic.product.manufacturing.","Electronic product manufacturing (x 1,000,000)",0.001008053129313
"Motor.vehicles.and.parts.manufacturing.","Motor vehicles and parts manufacturing (x 1,000,000)",0.00100189993997716
"Publishing.industries..except.Internet..","Publishing industries (except Internet) (x 1,000,000)",0.000995496443563838
"Pipeline.transportation.of.natural.gas.","Pipeline transportation of natural gas (x 1,000,000)",0.000991766125723713
"Textile..clothing.and.leather.product.manufacturing.","Textile, clothing and leather product manufacturing (x 1,000,000)",0.000991629984030844
"Radio.and.television.broadcasting.","Radio and television broadcasting (x 1,000,000)",0.000983966431492335
"Information.and.communication.technology..manufacturing.","Information and communication technology, manufacturing (x 1,000,000)",0.000968782230625726
"Hardware.manufacturing.","Hardware manufacturing (x 1,000,000)",0.000960318609349691
"Computer.and.electronic.product.manufacturing.","Computer and electronic product manufacturing (x 1,000,000)",0.000950425990311254
"Machine.shops..turned.product..and.screw..nut.and.bolt.manufacturing.","Machine shops, turned product, and screw, nut and bolt manufacturing (x 1,000,000)",0.000925479495043018
"Machinery.manufacturing.","Machinery manufacturing (x 1,000,000)",0.000913250755540765
"Communications.equipment.manufacturing.","Communications equipment manufacturing (x 1,000,000)",0.000891568394091196
"Miscellaneous.store.retailers.","Miscellaneous store retailers (x 1,000,000)",0.000888793054947759
"Aerospace.product.and.parts.manufacturing.","Aerospace product and parts manufacturing (x 1,000,000)",0.000870613292786527
"Warehousing.and.storage.","Warehousing and storage (x 1,000,000)",0.000859120532963095
"Food..beverage.and.tobacco.wholesaler.distributors.","Food, beverage and tobacco wholesaler-distributors (x 1,000,000)",0.000858254980124652
"Spring.and.wire.product.manufacturing.","Spring and wire product manufacturing (x 1,000,000)",0.000824823585130447
"Agricultural..construction.and.mining.machinery.manufacturing.","Agricultural, construction and mining machinery manufacturing (x 1,000,000)",0.000817885795016692
"Stone.mining.and.quarrying.","Stone mining and quarrying (x 1,000,000)",0.000807060434415641
"Primary.metal.manufacturing.","Primary metal manufacturing (x 1,000,000)",0.000805214918202435
"Other.non.metallic.mineral.mining.and.quarrying..except.potash..","Other non-metallic mineral mining and quarrying (except potash) (x 1,000,000)",0.000801771373993502
"Content.and.media.sector.","Content and media sector (x 1,000,000)",0.000798625289294143
"Motor.vehicle.body.and.trailer.manufacturing.","Motor vehicle body and trailer manufacturing (x 1,000,000)",0.000791788912219571
"Postal.service.","Postal service (x 1,000,000)",0.000743004317704767
"Electric.lighting.equipment.manufacturing.","Electric lighting equipment manufacturing (x 1,000,000)",0.000730376563470632
"Elementary.and.secondary.schools.","Elementary and secondary schools (x 1,000,000)",0.000715911016493715
"Alumina.and.aluminum.production.and.processing.","Alumina and aluminum production and processing (x 1,000,000)",0.000713773644234076
"Other.general.purpose.machinery.manufacturing.","Other general-purpose machinery manufacturing (x 1,000,000)",0.000671505007658482
"Clothing.and.leather.and.allied.product.manufacturing.","Clothing and leather and allied product manufacturing (x 1,000,000)",0.000666131194083099
"Urban.transit.systems.","Urban transit systems (x 1,000,000)",0.000652776296095341
"Data.processing..hosting..and.related.services.","Data processing, hosting, and related services (x 1,000,000)",0.000638241711206534
"Other.transit.and.ground.passenger.transportation.and.scenic.and.sightseeing.transportation.","Other transit and ground passenger transportation and scenic and sightseeing transportation (x 1,000,000)",0.000630513510650027
"Resin..synthetic.rubber..and.artificial.and.synthetic.fibres.and.filaments.manufacturing.","Resin, synthetic rubber, and artificial and synthetic fibres and filaments manufacturing (x 1,000,000)",0.000624429766251057
"Boiler..tank.and.shipping.container.manufacturing.","Boiler, tank and shipping container manufacturing (x 1,000,000)",0.000620269412453684
"Pharmaceutical.and.medicine.manufacturing.","Pharmaceutical and medicine manufacturing (x 1,000,000)",0.000619144847270396
"Pulp..paper.and.paperboard.mills.","Pulp, paper and paperboard mills (x 1,000,000)",0.000615722432745349
"Steel.product.manufacturing.from.purchased.steel.","Steel product manufacturing from purchased steel (x 1,000,000)",0.000597038115809476
"Chemical.manufacturing.","Chemical manufacturing (x 1,000,000)",0.000577778201875633
"Paper.manufacturing.","Paper manufacturing (x 1,000,000)",0.000526266285470773
"Soap..cleaning.compound.and.toilet.preparation.manufacturing.","Soap, cleaning compound and toilet preparation manufacturing (x 1,000,000)",0.000519920143963253
"Foundries.","Foundries (x 1,000,000)",0.000519711152770986
"Conventional.oil.and.gas.extraction.","Conventional oil and gas extraction (x 1,000,000)",0.000516395553936854
"Rubber.product.manufacturing.","Rubber product manufacturing (x 1,000,000)",0.000515706002081407
"Support.activities.for.mining.and.oil.and.gas.extraction.","Support activities for mining and oil and gas extraction (x 1,000,000)",0.000514238821430629
"Sporting.goods..hobby..book.and.music.stores.","Sporting goods, hobby, book and music stores (x 1,000,000)",0.000501366503015526
"Railroad.rolling.stock.manufacturing.","Railroad rolling stock manufacturing (x 1,000,000)",0.000489284736484874
"Non.metallic.mineral.mining.and.quarrying.","Non-metallic mineral mining and quarrying (x 1,000,000)",0.000483032330382632
"Architectural.and.structural.metals.manufacturing.","Architectural and structural metals manufacturing (x 1,000,000)",0.000474990435509863
"Management.of.companies.and.enterprises.","Management of companies and enterprises (x 1,000,000)",0.000456479099634227
"Agencies..brokerages.and.other.insurance.related.activities.","Agencies, brokerages and other insurance related activities (x 1,000,000)",0.000456068488207223
"Other.non.metallic.mineral.mining.and.quarrying.","Other non-metallic mineral mining and quarrying (x 1,000,000)",0.000449335869030997
"Ventilation..heating..air.conditioning.and.commercial.refrigeration.equipment.manufacturing.","Ventilation, heating, air-conditioning and commercial refrigeration equipment manufacturing (x 1,000,000)",0.000448621571075203
"Petroleum.and.coal.products.manufacturing..except.petroleum.refineries..","Petroleum and coal products manufacturing (except petroleum refineries) (x 1,000,000)",0.000441951506821918
"Furniture.and.home.furnishings.stores.","Furniture and home furnishings stores (x 1,000,000)",0.000441669849485227
"Cutlery..hand.tools.and.other.fabricated.metal.product.manufacturing.","Cutlery, hand tools and other fabricated metal product manufacturing (x 1,000,000)",0.000440717043953539
"Animal.production.","Animal production (x 1,000,000)",0.000436201484532772
"Travel.arrangement.and.reservation.services.","Travel arrangement and reservation services (x 1,000,000)",0.000435008781592576
"Other.electrical.equipment.and.component.manufacturing.","Other electrical equipment and component manufacturing (x 1,000,000)",0.000426792347541149
"Dairy.product.manufacturing.","Dairy product manufacturing (x 1,000,000)",0.000416985363877281
"Computer.and.peripheral.equipment.manufacturing.","Computer and peripheral equipment manufacturing (x 1,000,000)",0.000416335151176668
"Forestry.and.logging.","Forestry and logging (x 1,000,000)",0.000402731088743515
"Ship.and.boat.building.","Ship and boat building (x 1,000,000)",0.000397848302082097
"Textile.and.textile.product.mills.","Textile and textile product mills (x 1,000,000)",0.000392021554885442
"Other.furniture.related.product.manufacturing.","Other furniture-related product manufacturing (x 1,000,000)",0.000387892019867538
"Furniture.and.related.product.manufacturing.","Furniture and related product manufacturing (x 1,000,000)",0.000385526363941453
"Copper..nickel..lead.and.zinc.ore.mining.","Copper, nickel, lead and zinc ore mining (x 1,000,000)",0.000384978082404288
"Metalworking.machinery.manufacturing.","Metalworking machinery manufacturing (x 1,000,000)",0.000380666324925538
"Legal.services.","Legal services (x 1,000,000)",0.000377716001964517
"Household.and.institutional.furniture.and.kitchen.cabinet.manufacturing.","Household and institutional furniture and kitchen cabinet manufacturing (x 1,000,000)",0.000372784613984098
"Electric.power.generation..transmission.and.distribution.","Electric power generation, transmission and distribution (x 1,000,000)",0.000368307932987282
"Basic.chemical.manufacturing.","Basic chemical manufacturing (x 1,000,000)",0.000366848891524582
"Meat.product.manufacturing.","Meat product manufacturing (x 1,000,000)",0.000360233492894655
"Other.wood.product.manufacturing.","Other wood product manufacturing (x 1,000,000)",0.000355103487648688
