"","StationaryDistribution","GOP","Membership","QuantileDR.10","QuantileDR.25","QuantileDR.35","QuantileDR.45","QuantileDR.50","QuantileDR.65","QuantileDR.75","QuantileDR.85","QuantileDR.95","Ticker","Name"
"CYH.TO",0.006,0.022,1,-0.006,-0.003,-0.001,0,0,0.002,0.004,0.006,0.009,"CYH.TO","iShares Global Monthly Dividend Index ETF (CAD-Hedged)"
"XTR.TO",0.007,0.026,1,-0.003,-0.001,0,0,0,0.001,0.002,0.002,0.004,"XTR.TO","iShares Diversified Monthly Income ETF"
"CVD.TO",0.003,0.012,1,-0.005,-0.003,-0.001,-0.001,0,0.001,0.002,0.005,0.007,"CVD.TO","iShares Convertible Bond Index ETF"
"CPD.TO",0.004,0.014,1,-0.003,-0.001,-0.001,0,0.001,0.001,0.001,0.002,0.004,"CPD.TO","iShares S&P/TSX Canadian Preferred Share Index ETF"
"CMR.TO",0.001,0.005,1,0,0,0,0,0,0,0,0,0,"CMR.TO","iShares Premium Money Market ETF"
"XPF.TO",0.004,0.015,1,-0.003,-0.001,-0.001,0,0,0.001,0.001,0.002,0.003,"XPF.TO","iShares S&P/TSX North American Preferred Stock Index ETF (CAD-Hedged)"
"XFH.TO",0.016,0.045,1,-0.008,-0.003,-0.001,0,0.001,0.003,0.005,0.007,0.009,"XFH.TO","iShares Core MSCI EAFE IMI Index ETF (CAD-Hedged)"
"XEB.TO",0.003,0.012,1,-0.005,-0.002,-0.001,0,0,0,0.001,0.003,0.005,"XEB.TO","iShares J.P. Morgan USD Emerging Markets Bond Index ETF (CAD-Hedged)"
"CUD.TO",0.012,0.036,1,-0.007,-0.003,-0.001,0.001,0.001,0.003,0.004,0.006,0.01,"CUD.TO","iShares US Dividend Growers Index ETF (CAD-Hedged)"
"CSD.TO",0.002,0.01,1,-0.003,-0.001,-0.001,0,0,0.001,0.001,0.002,0.004,"CSD.TO","iShares Short Duration High Income ETF (CAD-Hedged)"
"CBN.TO",0.004,0.018,1,-0.007,-0.001,0,0,0,0.002,0.003,0.005,0.01,"CBN.TO","iShares Balanced Growth CorePortfolio Index ETF"
"XSU.TO",0.013,0.04,1,-0.008,-0.003,-0.001,0.001,0.002,0.004,0.006,0.008,0.013,"XSU.TO","iShares U.S. Small Cap Index ETF (CAD-Hedged)"
"CBD.TO",0.003,0.011,1,-0.004,-0.001,0,0,0,0.001,0.002,0.003,0.006,"CBD.TO","iShares Balanced Income CorePortfolio Index ETF"
"XHY.TO",0.003,0.014,1,-0.005,-0.002,-0.001,0,0,0.001,0.002,0.003,0.005,"XHY.TO","iShares U.S. High Yield Bond Index ETF (CAD-Hedged)"
"XHD.TO",0.007,0.025,1,-0.007,-0.003,-0.001,0,0,0.003,0.004,0.006,0.011,"XHD.TO","iShares U.S. High Dividend Equity Index ETF (CAD-Hedged)"
"XHC.TO",0.007,0.025,1,-0.009,-0.004,-0.001,0,0.001,0.004,0.005,0.008,0.012,"XHC.TO","iShares Global Healthcare Index ETF (CAD-Hedged)"
"XSP.TO",0.027,0.082,1,-0.007,-0.002,-0.001,0.001,0.001,0.002,0.005,0.007,0.012,"XSP.TO","iShares Core S&P 500 Index ETF (CAD-Hedged)"
"XRE.TO",0.003,0.012,1,-0.005,-0.003,-0.001,0,0.001,0.002,0.004,0.005,0.008,"XRE.TO","iShares S&P/TSX Capped REIT Index ETF"
"XIN.TO",0.02,0.06,1,-0.008,-0.003,-0.001,0,0.001,0.003,0.004,0.006,0.01,"XIN.TO","iShares MSCI EAFE Index ETF (CAD-Hedged)"
"XFF.TO",0.009,0.029,1,-0.008,-0.004,-0.002,0,0,0.003,0.004,0.008,0.011,"XFF.TO","iShares Edge MSCI Multifactor EAFE Index ETF (CAD-Hedged)"
"XFA.TO",0.006,0.023,1,-0.007,-0.001,0,0,0,0.002,0.004,0.007,0.012,"XFA.TO","iShares Edge MSCI Multifactor USA Index ETF"
"XMH.TO",0.015,0.047,1,-0.007,-0.002,-0.001,0.001,0.001,0.003,0.005,0.007,0.012,"XMH.TO","iShares S&P U.S. Mid-Cap Index ETF (CAD-Hedged)"
"CHB.TO",0.003,0.013,1,-0.005,-0.002,-0.001,-0.001,0,0.001,0.002,0.003,0.006,"CHB.TO","iShares U.S. High Yield Fixed Income Index ETF (CAD-Hedged)"
"XQQ.TO",0.014,0.044,1,-0.01,-0.003,-0.001,0,0.001,0.004,0.006,0.01,0.017,"XQQ.TO","iShares NASDAQ 100 Index ETF (CAD-Hedged)"
"XFR.TO",0.002,0.007,1,-0.001,0,0,0,0,0,0,0,0.001,"XFR.TO","iShares Floating Rate Index ETF"
"XUH.TO",0.019,0.06,1,-0.008,-0.003,0,0,0.001,0.004,0.005,0.007,0.011,"XUH.TO","iShares Core S&P U.S. Total Market Index ETF (CAD-Hedged)"
"XIT.TO",0.003,0.013,1,-0.011,-0.004,-0.002,0.001,0.002,0.006,0.008,0.011,0.015,"XIT.TO","iShares S&P/TSX Capped Information Technology Index ETF"
"XSC.TO",0.002,0.01,1,-0.002,-0.001,-0.001,0,0,0.001,0.001,0.001,0.002,"XSC.TO","iShares Conservative Short Term Strategic Fixed Income ETF"
"XSI.TO",0.002,0.011,1,-0.003,-0.001,-0.001,-0.001,0,0.001,0.001,0.002,0.003,"XSI.TO","iShares Short Term Strategic Fixed Income ETF"
"XCD.TO",0.004,0.016,1,-0.01,-0.003,0,0,0,0.003,0.005,0.009,0.013,"XCD.TO","iShares S&P Global Consumer Discretionary Index ETF (CAD-Hedged)"
"XBM.TO",0.004,0.014,1,-0.02,-0.009,-0.004,-0.001,0.001,0.005,0.01,0.015,0.024,"XBM.TO","iShares S&P/TSX Global Base Metals Index ETF"
"XEH.TO",0.01,0.031,1,-0.008,-0.003,-0.002,0,0.001,0.002,0.005,0.007,0.01,"XEH.TO","iShares MSCI Europe IMI Index ETF (CAD-Hedged)"
"XUT.TO",0.003,0.012,1,-0.007,-0.003,-0.002,0,0,0.001,0.002,0.004,0.008,"XUT.TO","iShares S&P/TSX Capped Utilities Index ETF"
"XST.TO",0.003,0.011,1,-0.008,-0.003,-0.002,0,0,0.002,0.004,0.006,0.011,"XST.TO","iShares S&P/TSX Capped Consumer Staples Index ETF"
"XGI.TO",0.004,0.018,1,-0.011,-0.002,0,0,0,0.002,0.005,0.008,0.012,"XGI.TO","iShares S&P Global Industrials Index ETF (CAD-Hedged)"
"XGB.TO",0.011,0.033,2,-0.003,-0.001,-0.001,0,0,0.001,0.001,0.002,0.003,"XGB.TO","iShares Canadian Government Bond Index ETF"
"XSH.TO",0.003,0.013,2,-0.002,-0.001,-0.001,0,0,0.001,0.001,0.001,0.002,"XSH.TO","iShares Core Canadian Short Term Corporate + Maple Bond Index ETF"
"XQB.TO",0.01,0.032,2,-0.002,-0.001,0,0,0,0,0.001,0.002,0.003,"XQB.TO","iShares Core High Quality Canadian Bond Index ETF"
"XLB.TO",0.013,0.036,2,-0.006,-0.003,-0.001,0,0,0.002,0.003,0.004,0.007,"XLB.TO","iShares Core Canadian Long Term Bond Index ETF"
"XHB.TO",0.003,0.01,2,-0.004,-0.001,-0.001,0,0,0.001,0.002,0.003,0.004,"XHB.TO","iShares Canadian HYBrid Corporate Bond Index ETF"
"XBB.TO",0.016,0.044,2,-0.003,-0.002,-0.001,0,0,0.001,0.001,0.002,0.003,"XBB.TO","iShares Core Canadian Universe Bond Index ETF"
"CLG.TO",0.006,0.021,2,-0.002,-0.001,-0.001,0,0,0,0.001,0.002,0.002,"CLG.TO","iShares 1-10 Year Laddered Government Bond Index ETF"
"CBH.TO",0.004,0.014,2,-0.003,-0.002,-0.001,0,0,0.001,0.001,0.002,0.003,"CBH.TO","iShares 1-10 Year Laddered Corporate Bond Index ETF"
"CLF.TO",0.005,0.018,2,-0.001,-0.001,-0.001,0,0,0.001,0.001,0.001,0.002,"CLF.TO","iShares 1-5 Year Laddered Government Bond Index ETF"
"XSQ.TO",0.002,0.01,2,-0.002,-0.001,-0.001,0,0,0,0.001,0.001,0.002,"XSQ.TO","iShares Core Short Term High Quality Canadian Bond Index ETF"
"XRB.TO",0.005,0.016,2,-0.006,-0.003,-0.002,0,0,0.002,0.003,0.005,0.007,"XRB.TO","iShares Canadian Real Return Bond Index ETF"
"XSB.TO",0.006,0.02,2,-0.001,-0.001,0,0,0,0,0.001,0.001,0.001,"XSB.TO","iShares Core Canadian Short Term Bond Index ETF"
"XCB.TO",0.006,0.02,2,-0.003,-0.001,-0.001,0,0,0.001,0.001,0.002,0.003,"XCB.TO","iShares Canadian Corporate Bond Index ETF"
"XSE.TO",0.004,0.013,2,-0.003,-0.001,-0.001,0,0,0.001,0.001,0.002,0.003,"XSE.TO","iShares Conservative Strategic Fixed Income ETF"
"CBO.TO",0.003,0.012,2,-0.002,-0.001,-0.001,-0.001,0,0.001,0.001,0.001,0.002,"CBO.TO","iShares 1-5 Year Laddered Corporate Bond Index ETF"
"XIG.TO",0.003,0.012,2,-0.004,-0.002,-0.001,0,0,0.001,0.002,0.003,0.004,"XIG.TO","iShares U.S. IG Corporate Bond Index ETF (CAD-Hedged)"
"^GSPTSE",0.039,0.093,3,-0.005,-0.002,-0.001,0,0.001,0.002,0.004,0.005,0.007,"-","-"
"XCV.TO",0.006,0.019,3,-0.006,-0.001,0,0,0,0.002,0.003,0.005,0.008,"XCV.TO","iShares Canadian Value Index ETF"
"XFC.TO",0.004,0.014,3,-0.007,-0.002,-0.001,0,0,0.002,0.005,0.006,0.009,"XFC.TO","iShares Edge MSCI Multifactor Canada Index ETF"
"CDZ.TO",0.025,0.071,3,-0.005,-0.002,-0.001,0,0,0.002,0.003,0.004,0.007,"CDZ.TO","iShares S&P/TSX Canadian Dividend Aristocrats Index ETF"
"XMV.TO",0.009,0.032,3,-0.005,-0.002,-0.001,0,0,0.001,0.002,0.004,0.007,"XMV.TO","iShares Edge MSCI Min Vol Canada Index ETF"
"XEN.TO",0.02,0.058,3,-0.005,-0.002,-0.001,0,0,0.002,0.003,0.005,0.009,"XEN.TO","iShares Jantzi Social Index ETF"
"XDV.TO",0.023,0.066,3,-0.005,-0.002,-0.001,0,0.001,0.002,0.003,0.004,0.006,"XDV.TO","iShares Canadian Select Dividend Index ETF"
"FIE.TO",0.012,0.035,3,-0.005,-0.001,0,0,0.001,0.001,0.003,0.004,0.006,"FIE.TO","iShares Canadian Financial Monthly Income ETF"
"CEW.TO",0.012,0.034,3,-0.006,-0.002,-0.001,0.001,0.001,0.002,0.003,0.005,0.008,"CEW.TO","iShares Equal Weight Banc & Lifeco ETF"
"XIC.TO",0.039,0.095,3,-0.005,-0.002,-0.001,0,0.001,0.002,0.004,0.005,0.007,"XIC.TO","iShares Core S&P/TSX Capped Composite Index ETF"
"XFN.TO",0.015,0.041,3,-0.005,-0.002,-0.001,0,0.001,0.002,0.004,0.005,0.007,"XFN.TO","iShares S&P/TSX Capped Financials Index ETF"
"XEG.TO",0.004,0.016,3,-0.016,-0.006,-0.003,-0.001,0.001,0.005,0.008,0.014,0.023,"XEG.TO","iShares S&P/TSX Capped Energy Index ETF"
"XEI.TO",0.024,0.066,3,-0.006,-0.002,-0.001,0,0,0.002,0.003,0.005,0.007,"XEI.TO","iShares Core S&P/TSX Composite High Dividend Index ETF"
"XIU.TO",0.035,0.087,3,-0.006,-0.002,-0.001,0,0.001,0.002,0.003,0.005,0.008,"XIU.TO","iShares S&P/TSX 60 Index ETF"
"XMD.TO",0.009,0.027,3,-0.007,-0.002,-0.001,0,0,0.002,0.003,0.005,0.008,"XMD.TO","iShares S&P/TSX Completion Index ETF"
"XCG.TO",0.003,0.012,3,-0.007,-0.002,0,0,0,0.001,0.003,0.005,0.01,"XCG.TO","iShares Canadian Growth Index ETF"
"XCS.TO",0.006,0.02,3,-0.009,-0.004,-0.002,-0.001,0,0.003,0.004,0.007,0.011,"XCS.TO","iShares S&P/TSX SmallCap Index ETF"
"COW.TO",0.005,0.018,4,-0.011,-0.004,-0.002,-0.001,0,0.004,0.006,0.009,0.013,"COW.TO","iShares Global Agriculture Index ETF"
"XAW.TO",0.041,0.104,4,-0.007,-0.003,-0.001,0,0.001,0.003,0.005,0.007,0.011,"XAW.TO","iShares Core MSCI All Country World ex Canada Index ETF"
"XWD.TO",0.042,0.109,4,-0.006,-0.003,-0.001,0,0.001,0.003,0.004,0.007,0.011,"XWD.TO","iShares MSCI World Index ETF"
"XUS.TO",0.045,0.108,4,-0.008,-0.003,-0.001,0.001,0.002,0.004,0.005,0.008,0.012,"XUS.TO","iShares Core S&P 500 Index ETF"
"XMI.TO",0.011,0.034,4,-0.006,-0.003,-0.001,0,0.001,0.002,0.004,0.006,0.009,"XMI.TO","iShares Edge MSCI Min Vol EAFE Index ETF"
"XFS.TO",0.003,0.012,4,-0.009,-0.001,0,0,0,0.003,0.004,0.007,0.015,"XFS.TO","iShares Edge MSCI Multifactor USA Index ETF (CAD-Hedged)"
"XEU.TO",0.012,0.037,4,-0.007,-0.003,-0.002,0,0,0.003,0.005,0.007,0.011,"XEU.TO","iShares MSCI Europe IMI Index ETF"
"CIF.TO",0.003,0.013,4,-0.008,-0.004,-0.002,0,0,0.003,0.005,0.007,0.01,"CIF.TO","iShares Global Infrastructure Index ETF"
"XFI.TO",0.004,0.016,4,-0.008,-0.003,-0.001,0,0,0.002,0.005,0.007,0.011,"XFI.TO","iShares Edge MSCI Multifactor EAFE Index ETF"
"CWW.TO",0.004,0.014,4,-0.008,-0.004,-0.002,0,0.001,0.003,0.005,0.008,0.012,"CWW.TO","iShares Global Water Index ETF"
"XMW.TO",0.011,0.035,4,-0.007,-0.003,0,0,0.001,0.003,0.004,0.006,0.009,"XMW.TO","iShares Edge MSCI Min Vol Global Index ETF"
"XMU.TO",0.011,0.034,4,-0.008,-0.003,-0.001,0,0.001,0.004,0.005,0.007,0.01,"XMU.TO","iShares Edge MSCI Min Vol USA Index ETF"
"XMC.TO",0.012,0.037,4,-0.009,-0.003,-0.001,0,0.001,0.004,0.006,0.008,0.012,"XMC.TO","iShares S&P U.S. Mid-Cap Index ETF"
"XHU.TO",0.003,0.012,4,-0.006,-0.002,0,0,0,0.003,0.004,0.006,0.01,"XHU.TO","iShares U.S. High Dividend Equity Index ETF"
"CGR.TO",0.003,0.011,4,-0.009,-0.004,-0.002,0,0.001,0.003,0.004,0.007,0.011,"CGR.TO","iShares Global Real Estate Index ETF"
"XUU.TO",0.039,0.095,4,-0.009,-0.003,-0.001,0.001,0.001,0.004,0.006,0.008,0.012,"XUU.TO","iShares Core S&P U.S. Total Market Index ETF"
"XEF.TO",0.024,0.068,4,-0.007,-0.003,-0.001,0,0.001,0.003,0.005,0.006,0.01,"XEF.TO","iShares Core MSCI EAFE IMI Index ETF"
"^GSPC",0.009,0.021,5,-0.007,-0.002,-0.001,0.001,0.001,0.002,0.004,0.008,0.012,"-","-"
"^NDX",0.007,0.019,5,-0.011,-0.003,-0.001,0,0.001,0.004,0.006,0.01,0.017,"-","-"
"ITOT",0.009,0.02,5,-0.007,-0.002,-0.001,0,0.001,0.003,0.005,0.008,0.012,"ITOT","iShares Trust - iShares Core S&P Total U.S. Stock Market ETF"
"XMA.TO",0.006,0.018,6,-0.012,-0.006,-0.004,-0.001,0.001,0.004,0.006,0.008,0.014,"XMA.TO","iShares S&P/TSX Capped Materials Index ETF"
"XGD.TO",0.005,0.017,6,-0.017,-0.007,-0.004,-0.002,0,0.003,0.006,0.01,0.018,"XGD.TO","iShares S&P/TSX Global Gold Index ETF"
"CGL.TO",0.004,0.015,6,-0.009,-0.005,-0.003,-0.001,0,0.003,0.004,0.006,0.012,"CGL.TO","iShares Gold Bullion ETF"
"SVR.TO",0.004,0.014,6,-0.014,-0.007,-0.004,-0.001,0,0.002,0.006,0.009,0.017,"SVR.TO","iShares Silver Bullion ETF"
"XMM.TO",0.01,0.031,7,-0.009,-0.004,-0.001,0,0,0.003,0.005,0.007,0.011,"XMM.TO","iShares Edge MSCI Min Vol Emerging Markets Index ETF"
"XID.TO",0.004,0.015,7,-0.01,-0.005,-0.003,-0.001,0,0.003,0.006,0.009,0.017,"XID.TO","iShares India Index ETF"
"XEM.TO",0.015,0.038,7,-0.013,-0.006,-0.003,0,0.001,0.004,0.007,0.01,0.014,"XEM.TO","iShares MSCI Emerging Markets Index ETF"
"XCH.TO",0.008,0.025,7,-0.017,-0.008,-0.004,-0.001,0,0.005,0.009,0.014,0.021,"XCH.TO","iShares China Index ETF"
"XEC.TO",0.016,0.038,7,-0.013,-0.005,-0.003,-0.001,0,0.003,0.006,0.01,0.014,"XEC.TO","iShares Core MSCI Emerging Markets IMI Index ETF"
